{
  "broadcast_id": "v166-closure-upgrade-serial-5x5-20260313",
  "created_at_utc": "2026-03-13T09:30:00Z",
  "expire_at_utc": "2026-03-27T09:30:00Z",
  "title": "[v1.6.6] mandatory wrapper-only closure replay (5+5 serial)",
  "message": "This is a protocol-mandated v1.6.6 closure broadcast for all runtime identities.\\n\\nRequired (serial, no parallel):\\n1) refresh contracts: python3 scripts/repair_contract_backfill.py --catalog <runtime_catalog> --identity-id <identity_id> --apply --json-only\\n2) ensure wrapper signer env is set for your identity: IDENTITY_PROTOCOL_GATEWAY_SIGNING_SECRET_<IDENTITY_UPPER>=<secret>\\n3) run strict update chain through creator: python3 scripts/identity_creator.py update --identity-id <identity_id> --mode safe-auto --actor-id <actor_id> --session-id <session_id> --why-now v166_closure --planned-file <plan_file>\\n4) run 5 serial self-tests via wrappers (ingress->unique-entry->egress), each round must PASS_REQUIRED\\n5) run 5 serial deep scans: python3 scripts/full_identity_protocol_scan.py --scan-mode target --identity-ids <identity_id> --target-source-layer <project|global> --actor-id <actor_id> --session-id <session_id> --expected-work-layer instance --expected-source-layer <project|global> --out <out_json>\\n6) ack this broadcast after completion: python3 scripts/identity_broadcast_ack.py --catalog <runtime_catalog> --identity-id <identity_id> --ack-all-pending --actor-id <actor_id> --session-id <session_id> --json-only\\n\\nPass criteria: self-test(5/5 PASS_REQUIRED) + deep-scan(5/5 rc=0,p0=0,m2m_fail=0). If failed, emit protocol-feedback outbox with error codes and rerun after repair.",
  "severity": "critical",
  "requires_ack": true,
  "scope": "all",
  "tags": [
    "v1.6.6",
    "wrapper-only",
    "serial-5x5",
    "closure"
  ],
  "metadata": {
    "stream_version": "v1.6.6",
    "governance_doc": "docs/governance/identity-host-unique-channel-governance-v1.6.6.md",
    "review_doc": "docs/review/protocol-remediation-audit-ledger-v1.6.6.md",
    "required_actor_session_binding": true,
    "notes": [
      "Do not bypass wrapper entry/egress.",
      "Do not run parallel loops.",
      "Use protocol tools; no manual runtime hand wiring."
    ]
  }
}
